id,code,comment1,comment2,comment3,rating,searched,emotions
98,CS3243,"I''m really disheartened as well. For the record all my CS/Math mods so far are A(>50%A+), and this is my first paper in NUS which I left half of it blank. (I didn''t say this to showoff, just wanna use this to tell those who left half the paper blank that they didn''t do badly)

For those who left more than half blank, don''t be disheartened. It''s not that you don''t know the content, I just think this paper is unfair. Most questions are doable (if given enough time), but the amount of questions (especially since most questions have lengthy descriptions that spans multiple paragraphs) it just isn''t right. I don''t think I can finish this paper even if you give me extra 1 hour.

Also the format of this exam just isn''t suitable for luminus quiz. Imagine a module like CS1231S where u are asked to proof some logical statements and need to write many lines for the proof, except that you need to type them all down on LumiNus. There''s this one 4 mark question where I literally just spent 10 mins typing out the answer after I already worked out the answer lol what a waste of time. By contrast, I''m also taking CS2102 this sem and I find the paper very well set. Some questions for CS2102 also requires working out the steps, and proving logical statements etc (like 3243) but the prof did very well in converting them into MRQ statements with like a whole list of options (each option one clause) and u just need to tick whichever clause you need. Hopefully 3243 paper can be set in a similar manner.",I'm gone too haha more than 50% untouched,"Took 3243 last sem 2. All lectures recorded.

HOWEVER, SoC is going back to in-person lectures/tutorials next sem, so we really don''t know what will happen.",4.47,0,"8.32,12.76,5.77,28.52,44.62"
99,CS3244,"Andrew Ng’s ML intro course on Coursera

Edit: not resourced used in the module but very relevant and beginner friendly course if u are new to ML","The intro course is enough for 3244 syllabus (at least cover most of it) but if u want to take more initiatives for 3244 proj or want to dive deeper into AI/ML, can take the specialized courses on Coursera.","3244 proj doesn’t restrict ur choice of ML libraries used. So whether you want to learn tensorflow is up to you.

Btw, Prof Xavier Bresson’s lab codes for CS4243 this sem provides a good hands on intro to PyTorch, and you can find it here https://github.com/xbresson/CS4243_2022",4.68,0,"20,20,13.4,0,46.6"
100,CS3245,"If you are considering to take most of these modules, please do not take all of them together else your exchange will be just studying. Especially CS3230, it is notoriously difficult. Other than that, CS2113 might be time-consuming if you don''t have SWE experience prior but still doable. CS2107 has CTF assignments which are again time-consuming. In general, try to take a UE mod to buffer your CS mods, as CS mods in NUS are pretty intense compared to western counterparts.",None of my fds are studying these courses so I’m looking for ppl to study with! I have some prior experiences in ai/ml so decided to take them together and hopefully I won’t die lol,Hi I'm taking 3243 this sem and alrdy taken 3244,5.21,0,"21.7,9.2,20,20,29.1"
101,CS3281,"Apparently, I have read that like a sem ago oops...

Anyway, for those who have the same question this is for the first question:

>Both CS3216 and CS3217 are 5-MC modules. Students who choose to take CS3216 and CS3217 will count 8-MC towards the Computer Systems Team Project requirement and 2- MC towards Unrestricted Electives. Students must take both CS3216 and CS3217 to complete the Software Engineering Team Project requirement. If a student completed only one of CS3216 and CS3217, he or she has to take another pair of modules to meet the Computer Systems Team Project requirement.

So I believe if I were to just do CS3216, I will need to do CS3281 + CS3282 OR CS3203.

&#x200B;

Searching for the 2nd one now, will edit later. (Okay if anyone can find this, please... Can''t seem to find it :'') )","I agree with you. Just to add on, CS3203 would also demand a lot of your time if the team dynamics aren''t good, which might possibly lead you to sacrificing your other modules. Since the requirements for the project are already set, it is important that you are 100% familiar with them if you wanna do well. As for CS3281/CS3282, since it''s split over 2 semesters, the workload definitely won''t be as heavy as 3203 for a single semester. Plus, they build upon CS2103 knowledge and they are coordinated by the same prof so if you truly enjoyed CS2103, i think these 2 mods would enhance your knowledge greatly. In terms of the group size, i think the group size for 3281 is definitely smaller (maybe just 2 or 3 in a team).

tldr; if you didn''t enjoy 2103 or just want to clear the 8MC requirement asap, take CS3203. If you enjoyed 2103 and want to work on projects that are currently used by many others  (such as TEAMMATES), 3281/3282 would be great.","1. Your first question can literally be found on the NUS CS graduation requirements website.
2. If you read the email sent out to all students by ModReg, you''d notice there''s this particular sentence at the bottom of the email. Go read that and you will find your answer to your second question.",5.46,0,"19.8,3,6.8,17.6,52.8"
102,CS3282,"Apparently, I have read that like a sem ago oops...

Anyway, for those who have the same question this is for the first question:

>Both CS3216 and CS3217 are 5-MC modules. Students who choose to take CS3216 and CS3217 will count 8-MC towards the Computer Systems Team Project requirement and 2- MC towards Unrestricted Electives. Students must take both CS3216 and CS3217 to complete the Software Engineering Team Project requirement. If a student completed only one of CS3216 and CS3217, he or she has to take another pair of modules to meet the Computer Systems Team Project requirement.

So I believe if I were to just do CS3216, I will need to do CS3281 + CS3282 OR CS3203.

&#x200B;

Searching for the 2nd one now, will edit later. (Okay if anyone can find this, please... Can''t seem to find it :'') )","1. Your first question can literally be found on the NUS CS graduation requirements website.
2. If you read the email sent out to all students by ModReg, you''d notice there''s this particular sentence at the bottom of the email. Go read that and you will find your answer to your second question.","I agree with you. Just to add on, CS3203 would also demand a lot of your time if the team dynamics aren''t good, which might possibly lead you to sacrificing your other modules. Since the requirements for the project are already set, it is important that you are 100% familiar with them if you wanna do well. As for CS3281/CS3282, since it''s split over 2 semesters, the workload definitely won''t be as heavy as 3203 for a single semester. Plus, they build upon CS2103 knowledge and they are coordinated by the same prof so if you truly enjoyed CS2103, i think these 2 mods would enhance your knowledge greatly. In terms of the group size, i think the group size for 3281 is definitely smaller (maybe just 2 or 3 in a team).

tldr; if you didn''t enjoy 2103 or just want to clear the 8MC requirement asap, take CS3203. If you enjoyed 2103 and want to work on projects that are currently used by many others  (such as TEAMMATES), 3281/3282 would be great.",5.46,0,"19.8,3,6.8,17.6,52.8"
103,CS4211,"I''ve done 4243 and 4218.

Did 4243 under prof Angela two sems ago. It has quite a lot of linear algebra involved, but minimal AI concepts, because it doesn''t cover state-of-the-art ML-based methods of CV, but rather traditional CV methods. But linear algebra foundation must be good. Didn''t score well for it because back then my linear algebra knowledge and my grasp of Python libraries (numpy, pandas) weren''t great.

Did 4218 under prof Cristina last sem. I liked it quite abit but that may be a biased opinion since I enjoy software dev and tend to score better for SWE mods. It''s well-structured and the semester-long project aligns rather well with weekly lecture content. Unless the project task has changed, you''ll essentially be finishing implementation for a 75%-done CLI project, and then writing many many test cases. So be prepared to spend slightly more than average time on it, but this tends to be the case for most SWE project-based mods anyway.

Feel free to DM me if you wanna take a look at lecture content for these mods!",Am here to say good luck :’) have fun using this dated model checker called SPIN for lab. I do hope they’ve changed it.,hi there! I’m taking this mod too and yes my friends and I defo did not know what we were doing LMAO our goal was just to hand something up,5.48,0,"24.28,16.15,7.51,14.64,37.42"
105,CS4220,"HAHA sorz :( i am indeed a cs student, thinking of trying out some bioinformatics probably next sem to see how i like it. 

edit: dug around some more on one of the lecturer''s website and found some additional stuff. you can dig around as well on his website!

CS2200 https://www.comp.nus.edu.sg/~wongls/courses/cs2220/2012/


CS4220 https://www.comp.nus.edu.sg/~wongls/courses/cs4220/2019/","Hi, as a computational biology major myself, I havent taken the modules but i know of people who have. PM me if you’d like to get contact with any of them.",NULL,6.91,0,"0,33,0,0,67"
106,CS4222,"CS3103 - took this mod last AY. very chill. Basically just go to the labs every week and complete and submit the lab assignments there. Has some homework and programming assignments, but they don’t really take a long time to complete. The lectures are mostly revision of CS2105 materials / basic networking knowledge.

CS4226 - took this mod last AY. Also relatively chill. Course starts off pretty difficult, but it gradually gets easier. First part of the course is mostly about network performance and queueing systems (m/m/1), resource allocation. Thus, there are some probability requirements. Towards the later half of the semester, the topics are pretty much very simple (BGP, SDN and P2P). Mod is very easy if you have a strong probability background, since the last few chapters aren’t difficult to understand and PYP is available for practice too, so the bulk of the difficult content is in midterms and so long as you master that content it comes out for finals too.","CS4222 -  Took it last sem. In the beginning, the lecture content is more about an overview and the basics of wireless communication, so it is easy. While after recess week I believe it becomes pretty content-heavy. Need to fully understand many protocols for localization, discovery, MAC and routing. Fortunately, the math is relatively simple and the final is open book. Prof and TA are all very nice and patient and the project is not hard and quite fun. Overall a good module to take if you are interested in communication protocols or devices like SensorTag. 

Evaluation (CS4222/CS5422)
  

  
Programming assignments + projects (55%)
  
 \- 2 individual programming assignments (10%)
  
 \- 2 group programming assignments (Groups of 2 to 4 members) (20%)
  
 \- 1 group project (Groups of 2 to 4 members) (25%)

  
Written Assignment (10%)
  
Tutorial Attendance (5%)
  
Final Assessment, open book (30%)","“Usefulness” depends on your future plans. But I think generally, cs3103 is a lot more “useful”.",5.93,0,"15.28,1.99,7.31,37.21,38.21"
107,CS4225,"CS students don''t usually have preallocated mods after the 1ks (afaik at least). Since that mod is also a focus area primary, it would mostly have CS students looking to do the Database Systems focus area, and want to do the mod willingly and well. So you should expect some competition","Took it this semester under Prof He. It’s a pretty interesting mod if you’re interested in distributed frameworks and want to learn how different implementation and algorithm decisions affect performance of big data systems. The breakdown for this semester was 2 lab assignments (10% each; one with Hadoop and the other with Spark), 1 course project (10% proposal; 10% presentation; 20% report), 1 final quiz (35%) and attendance (5%). Workload wise is quite manageable — you’ll probably spend a bulk of the time on the lab assignments and course projects.",Couldn't really find much online too but maybe this will help https://spark.apache.org/docs/latest/rdd-programming-guide.html,4.91,0,"33.11,0,11.04,3.68,52.17"
108,CS4226,"cs4226

first part is on queuing theory, where you will need a pretty decent understanding of Poisson distributions. The module only covers M/M/1 queueing model, but covers it in detail. this part extends to recess week.

second part you will go into topical learning of more modern networking concepts like bgp routing, p2p networks and sdn.

assignment is on sdn, this one just search for cs4226 on github and you will get an idea of what will be done. (this is the only coding involved in the mod)

overall if you''re interested in the internet infrastructure you can take this class. you will understand why a lot of things in the internet are designed in a certain way.

grades wise -- midterm can be practised since it''s mathematical, and the assignment is easy","CS3103 - took this mod last AY. very chill. Basically just go to the labs every week and complete and submit the lab assignments there. Has some homework and programming assignments, but they don’t really take a long time to complete. The lectures are mostly revision of CS2105 materials / basic networking knowledge.

CS4226 - took this mod last AY. Also relatively chill. Course starts off pretty difficult, but it gradually gets easier. First part of the course is mostly about network performance and queueing systems (m/m/1), resource allocation. Thus, there are some probability requirements. Towards the later half of the semester, the topics are pretty much very simple (BGP, SDN and P2P). Mod is very easy if you have a strong probability background, since the last few chapters aren’t difficult to understand and PYP is available for practice too, so the bulk of the difficult content is in midterms and so long as you master that content it comes out for finals too.","I''ve done 4243 and 4218.

Did 4243 under prof Angela two sems ago. It has quite a lot of linear algebra involved, but minimal AI concepts, because it doesn''t cover state-of-the-art ML-based methods of CV, but rather traditional CV methods. But linear algebra foundation must be good. Didn''t score well for it because back then my linear algebra knowledge and my grasp of Python libraries (numpy, pandas) weren''t great.

Did 4218 under prof Cristina last sem. I liked it quite abit but that may be a biased opinion since I enjoy software dev and tend to score better for SWE mods. It''s well-structured and the semester-long project aligns rather well with weekly lecture content. Unless the project task has changed, you''ll essentially be finishing implementation for a 75%-done CLI project, and then writing many many test cases. So be prepared to spend slightly more than average time on it, but this tends to be the case for most SWE project-based mods anyway.

Feel free to DM me if you wanna take a look at lecture content for these mods!",5.72,0,"13.69,12.13,11.13,18.26,44.79"
109,CS4238,"Took CS4238 in the most recent semester under Prof Liang, so it''ll probably be different in the coming semester. It''s mostly a practical-based module. 

The first half of the module was pretty chill and involved mostly discussing network attacks, web attacks and exploiting memory vulnerabilities (which are probably not new topics coming from CS3235). That said, there were homeworks and the labs were the focus of the module. Midterm covered the topics above.

Where the module really shined was in the second half of the semester when the prof brought in guest lecturers from CSIT to share their experience and TTP for malware analysis. Workload for the module wasn''t too high.","I''ve done 4243 and 4218.

Did 4243 under prof Angela two sems ago. It has quite a lot of linear algebra involved, but minimal AI concepts, because it doesn''t cover state-of-the-art ML-based methods of CV, but rather traditional CV methods. But linear algebra foundation must be good. Didn''t score well for it because back then my linear algebra knowledge and my grasp of Python libraries (numpy, pandas) weren''t great.

Did 4218 under prof Cristina last sem. I liked it quite abit but that may be a biased opinion since I enjoy software dev and tend to score better for SWE mods. It''s well-structured and the semester-long project aligns rather well with weekly lecture content. Unless the project task has changed, you''ll essentially be finishing implementation for a 75%-done CLI project, and then writing many many test cases. So be prepared to spend slightly more than average time on it, but this tends to be the case for most SWE project-based mods anyway.

Feel free to DM me if you wanna take a look at lecture content for these mods!","CS4243 taught by Prof Angela Yao last year was pretty fun. It gets a lot more mathy towards the end (will be great to have prior knowledge on SVD but not absolutely necessary). She breaks down concepts and math as simply as she can, and is open to public questions and clarifications. Most of the techniques taught are not state of the art but rather the stuff can came before CNNs. Flipped classroom.",6.21,0,"11,7.25,10.5,18.5,52.75"
110,CS4239,"I''ve done 4243 and 4218.

Did 4243 under prof Angela two sems ago. It has quite a lot of linear algebra involved, but minimal AI concepts, because it doesn''t cover state-of-the-art ML-based methods of CV, but rather traditional CV methods. But linear algebra foundation must be good. Didn''t score well for it because back then my linear algebra knowledge and my grasp of Python libraries (numpy, pandas) weren''t great.

Did 4218 under prof Cristina last sem. I liked it quite abit but that may be a biased opinion since I enjoy software dev and tend to score better for SWE mods. It''s well-structured and the semester-long project aligns rather well with weekly lecture content. Unless the project task has changed, you''ll essentially be finishing implementation for a 75%-done CLI project, and then writing many many test cases. So be prepared to spend slightly more than average time on it, but this tends to be the case for most SWE project-based mods anyway.

Feel free to DM me if you wanna take a look at lecture content for these mods!","CS4243 taught by Prof Angela Yao last year was pretty fun. It gets a lot more mathy towards the end (will be great to have prior knowledge on SVD but not absolutely necessary). She breaks down concepts and math as simply as she can, and is open to public questions and clarifications. Most of the techniques taught are not state of the art but rather the stuff can came before CNNs. Flipped classroom.","CS4226 the first part is on queuing theory where there''s a lot of statistical calculations involved to understand M/M/1 queueing discipline. Calculation-based midterm.

The second part is basically an extension of CS2105 where you learn in breadth what other network technologies there are like p2p, sdn, bgp. Assignment was on sdn.",5.38,0,"9,7.25,19.25,14.75,49.75"
144,EC3304,"Yeah, it''s true. I think that poor student submitted the exam early and the prof was flipping through his/her script lmao. The prof just said something along the lines of sorry I didn''t know the screen was shared. The answers submitted was wrong anyway.

The screen was shared as he was supposed to be sharing the question paper on the screen.",ya dude wtf was that paper… extra 10 mins but no  question paper…..,Why does it sound like the invigilator was flashing the qns on the screen,4.64,0,"0,13.01,7.34,42.6,37.04"
111,CS4240,"I''ve taken CS4249 last year, i would say that coding wise, its quite minimal but it really depends on your project. For my year, the project was basically finding improvements for an already existing app. I would say that the class had a good spread of NM and Computing students. Definitely expect 3240 kind of standard, but more focused on quantity than quality of user experience. So what i mean is that there will be more statistical analysis and showing your findings between your chosen app and the proposed prototype. I would say don''t worry too much about the coding wise, you can definitely try to find teammates that can do that share and you can contribute in other aspects.

For CS4240, I did not personally take it, but i took CS3247 under the same prof. You will definitely be enrolled to doing STePS if u choose to take CS4240. I have heard some experiences from some friends, and its definitely way more coding than CS4249. I feel that when it truly comes to really designing for the VR/AR space, i dont think this mod does well in that. I think the mod is more like an intro to AR/VR rather than UI/UX in VR/AR, which i think was what alot of people expected it to be.

At the end of the day, its really what your goal is. For me it was UI/UX and CS4249 definitely helped me for that. Hope it helps!","Took both 4240 and 4249. 

4249 is pretty much as /u/Willistay described, it felt more like a mini stats/science mod than anything CS - likely only need to make a basic front-end for stats logging, which you can leave to 1 or 2 of your groupmates to do. Very much a too many cooks spoil the broth situation. Otherwise, prof had pretty chill and interactive lectures as far as online lectures went, and would definitely recommend it for everyone, CS student or not.

4240 I absolutely do not recommend if you''re not able to code - the assignments basically require you to learn Unity and learn how to debug the damn VR headset not working etc. The final project could also potentially be extremely code heavy depending on what your team chooses.

If you are willing to learn how to essentially do game coding (or already know), 4240 is a free VR headset loan for the sem and is an absolute blast if you have a good enough PC at home.

In terms of learning, I can echo /u/Willistay - it''s more of an intro to developing in AR/VR, how to deal with motion sickness, what to avoid while to designing UIs in AR/VR applications etc. For the latter, I would say it needs a good understanding of how 3D games/applications are built to even know *how* to apply what is taught.

In summary, 4240 is a fun but somehwat workload heavy way to clear your 4k reqs but don''t expect to learn much if you''re already familiar with 3d/game dev. If you don''t have to clear a CS 4k and you can''t code, avoid.","i''m not sure what experience you had for your prereq for this module, but this mod focuses alot about comparing between different prototypes, statistics and survey feedback. So some examples were improvements to catering websites, movie websites and even some old NUS admin portals.

I think to be honest, i feel that CS3240 (or your NM equivalent) and CS4249 really focuses on different parts of UI/UX. Like i mentioned earlier, CS3240 is the quality side while CS4249 is the quantity side. I would say CS4249 is really helpful when it comes to quantifying responses from users. Gathering insights on your prototypes really show which prototype is statistically better. And the tools you are using are quite relevant IMO, like Qualtrics, JMP, AmazonTurk etc.

I didnt manage to land any intern on UI/UX so i cant say how much it helps in UI/UX, but taking this mod and CS3240 really helped me better understand UI/UX alot more. I would say it was one of the more enjoyable mods in CS. I personally take quite an interest in design so i really enjoyed this mod.",7.01,0,"23.75,1,18.39,18.06,38.8"
112,CS4243,"The prof is new. Received invitation for TA application for the mod and from the email, the prof gonna cover both traditional CV approaches and then in the later half of the sem, CNN based approaches for CV","I''ve done 4243 and 4218.

Did 4243 under prof Angela two sems ago. It has quite a lot of linear algebra involved, but minimal AI concepts, because it doesn''t cover state-of-the-art ML-based methods of CV, but rather traditional CV methods. But linear algebra foundation must be good. Didn''t score well for it because back then my linear algebra knowledge and my grasp of Python libraries (numpy, pandas) weren''t great.

Did 4218 under prof Cristina last sem. I liked it quite abit but that may be a biased opinion since I enjoy software dev and tend to score better for SWE mods. It''s well-structured and the semester-long project aligns rather well with weekly lecture content. Unless the project task has changed, you''ll essentially be finishing implementation for a 75%-done CLI project, and then writing many many test cases. So be prepared to spend slightly more than average time on it, but this tends to be the case for most SWE project-based mods anyway.

Feel free to DM me if you wanna take a look at lecture content for these mods!","As someone who''s currently taking a few algo mods (3236, 4231, 5330), I''d say apart from 3230, they won''t rly help technical interviews. 3230 is actually q useful for interviews, especially the part on dp, amortized analysis, and greedy algos. But you of course have to do some amount of leetcode grind to get the muscle memory and intuition.",5.55,0,"9.91,14.22,17.53,19.68,38.65"
