id,code,comment1,comment2,comment3,rating,searched,emotions
236,GEH1043,"Took this mod in 2020/2021 sem 1. Won’t talk about the level of enjoyment since it is relative but some concepts u will learn include details on diseases like HIV, malaria and plagues like the Black Death that have cause genoicide in human history.
Assessment critieria wise there is a mid term quiz(25%) that involve 60MCQs which u have to complete in 30mins. Honestly this is the killer portion. There is also a group project presentation on a certain microbiology topic. Most of us did pretty ok but the prof’s Q&A can be brutal. There is also a final report which u get to decide on a random microbiology topic to write. There is no word criteria but most of us wrote beyond 5 pages. The rest of the weightage are basically attendance grade and mini weekly quizzes that will be conducted during zoom. Couldn’t remember the weightage precisely but the group project, final report and mid term quiz make up most of the weightage.","The class size is ard 90 students and the lectures aren’t recorded. 

The mid term quiz is facilitated on luminous with proctoring. 

As for the group project I was kind of lucky considering the rest of my 4 group mates were from the school of life sciences and I am from engineering so I kind of got carried by them. The presentation will be conducted on zoom so frankly i just read from a prewritten script. Unless your group create absolute nonsense the prof will generally give all the groups a decent score. I heard the groups that were able to handle the prof’s Q&A session did better in this segment.","Difficulty: Moderate - High (considering it is a GE, it is the hardest GE amongst all the 5 I took) if it helps 60% of the class were life science students, but it is still very possible to do well as the content is catered to be understood by students of all majors

Workload: High

Took this one year ago so I''m not sure if they changed anything, but I won''t recommend to take this mod if your other modules are high in workload! The profs teaching it were great and the content was interesting though!",7.37,0,"18.3,5.01,17.54,21.05,38.1"
237,GEH1045,"oof not sure if this is harder than during my time. in my sem it was 36 questions in 10 min, but honestly i think it’s reasonable since you’re not meant to search the answers up plus the questions are fast to read anyway. if you know it, you know it, else you just skip the question. i managed to finish it in 7 minutes so i’m sure it’s not unreasonable.

i got 3 questions wrong and got A+, while my friend got around 10 questions wrong and got B+ so bell curve shouldn’t be that bad.","One of my core mods had a 80 qns 62 mins, and nope, not all of them are MCQs.

Its ok man... Just do your best and even if u didn''t think so, just treat it as an experience. (I think can just use your S/U so)","had a similar experience! i took it the semester COVID first hit, so no field trips but tutorials (mine were with the module professor) were f2f and quite engaging because of the group activities like mini presentations which counted to class participation, in addition to individual answering. quite interesting to learn from different perspectives too!

i had to put in quite a lot of effort for the essay because i’m not rly good with writing & had a hard time thinking of an appropriate essay title (which was up to us to choose, based on the topics covered in lecture, like religion & globalisation). but workload overall is light (MCQ test was easy) & a good grade is securable :-)",5.85,0,"14.04,9.4,15.41,12.03,49.12"
238,GEH1047,"Probably the most fun mod I''ve taken in NUS so far. Did this pre-covid, so really not sure how the module is conducted under e-learning formats. 

Lectures are interesting you get to learn how different people and groups develop their music and culture. Tutorials are weekly sessions where you get to learn and play music from different cultures and countries. (Sundanese, Balinese gamelan, south Indian music, African music) The tutorials are extremely fun and chill with no prep work needed. I strongly recommend taking pictures and videos of your playing and the instruments 

Workload is really really light, consisting of weekly journal updates on tutorial sessions, 2 concert reports (1 for each half sem) and a group presentation on local music etc.

 Tutorial Journal/wiki work 10% - As long as you regularly update your tutorial journals and  provide insightful comments and personal feelings + pics and videos, should easily get the 10%

 Quizzes 20% (4 total at 5% each) - Pay attention in the lectures and take notes. Quiz has a 10 min timer iirc. Other than that I cant rmb much abt it sorry :(

Concert Reports (2 concerts) 40% (20% each) - Just need to go watch 2 concerts (external/YST concerts) and write 2 reports about your feelings and observations at the concerts. You''ll be given guidelines to follow. Not too difficult but not sure how they''re gonna get you to watch concerts now.

 Lecture Group Presentation 30% - The most important part imo. If you can ace this and reports, think you should be safe for an A. (Don''t take my word for it) A group of 6-8 students and pick a topic on local music to present to the class. Need to do a bit of research and reach out to performers/artists/musicians in the local music scene and try to interview them. 

If you want anymore info can dm me :)","answer to your last qn:
luminus-> module search -> geh1047

copy pasted the last bit of the modes of assessment here for you

assessment/grade breakdown:
Concert Reports (2 concerts) 40% (20% each) 
Lecture Group Presentation 30%
Tutorial Journal/wiki work 10% 
Quizzes 20% (4 total at 5% each)",Two concert reports and a group presentation (wk12/13) based on a topic of your group's choice.,5.99,0,"29,7.25,28.75,8.25,26.75"
239,GEH1049,"I had a good time taking this mod and enjoyed it very much! took it during the sem where covid19 just started developing, so it went from physical lectures to online classes halfway. basically we had 2 grp project components (which were really fun to do), where u had to pick a public health issue in sg and write about it, a term paper about smoking and a smol mcq quiz that was not too hard. they will divide u into groups and my grp members were all strangers to me but we got along v well despite that :-)","Took it last sem and workload was pretty manageable mod i would say, lectures were pre-recorded and quite chill, there were 2 quizzes 1 regarding general research skills and citation and the other regarding the lectures taught, quite tricky mcqs tho but is openbook, projects wise comprises of 2 parts, part 1 on a report regarding the se model that will be taught and part 2 requires us to come up w a poster, grp was preallocated. The proj was okay but just gotta be detailed in the explanation and further elaboration but generally was okay. There was a final assignment for us comprises of 40% and we r required to answer 4 open-ended questions, it was okay as long as u do ur research. In a nutshell, an interesting module to take if u wanna noe more abt public health!","took in AY20/21 Sem 1  
 \*\*disclaimer: heard it was an easy mod pre-covid but grading structure completely changed without notice so i rly did not have a good time with this mod since it was diff to my expectations\*\*

  
lectures are all pre-recorded video by different speakers (for different topics) so can watch at own time  
5% research quiz (about citation, plagiarism, research skills etc) - think this was ard end of sem  
15% wk12 review quiz on luminus  
40% take-home assignment questions released via examplify on 9am had to submit by 6pm 3 or 4 questions all essays ard 700 words and had to include citations in word count  
15% Group Proj Part 1  
20% Group Proj Part 2  
5% peer evaluation

&#x200B;

I rly did not enjoy the grp proj as i did not want to put in so much effort but my teammates were so eager having 5-6hrs of calls each week. I had like 6 other mods that I had to take care of except GEH1049 so was just planning to SU this (which I did).",5.71,0,"13.76,26.01,19.13,13.76,27.35"
240,GEH1050,"Hihi! I love GEH modules lol. Mostly cus my area of interest is in the arts and I usually just pick whichever module I have a strong interest in. I think NUS students tend to prioritise easy modules but they overlook how personal interest in the topic can actually make the module so much easier to score in. A mod can be fully MCQ but if I have no interest in whatever is taught, I will prolly still do badly in it. But that''s just my own personal take. I can only share my experiences based on the GEH i have taken so here is a brief review of all of them:

GEH1055 Religion and film: You get to learn about different religions around the world through movie watching which is a win win to me. You will also learn how to analyse movies and scenes on top of learning about the religion. It''s a very interesting module but its not the easiest if you are not comfortable writing film analysis.

GEH1058 The theatre experience: If you have no prior exposure to theatre, this is a great introduction to the art form! Topics and ideas are explained in very simple terms and the content is very easy to understand. As long as you are engaged and interested, i think the workload is not bad at all. And you get to watch theatre shows haha (hopefully in person cus i took this mod during covid peak)

GEH1061 Representation and media: This is a pretty basic module. Quite a relevant one too because of the rise of media usage due to the pandemic. If you enjoy pop culture and media, this will be quite enjoyable. There are some technical terms and concepts you have to understand. The TA I had for this module was so kind and sweet haha. Workload is manageable, i think the hardest part was probably the quiz but still doable i guess.

Next sem I''m going to take GEH 1060 History of Piano only because I heard that the assignments are mostly personal reflections. (which are my favourite kind of assignments cus I''m pretty good at bullshitting) And also I play a bit of piano so I thought it might be fun to learn a little about the instrument. But I still can''t vouch for it cus I''ve not taken it yet.

HAVE FUN!! :))",nope he didnt record it! he forgot to haha but he said he will record it next week onwards,yeap! think hybrid just means there are some sessions conducted in-person and the rest are conducted online,6.15,0,"36.71,11.96,9.53,23.16,18.65"
241,GEH1053,"Friend of mine took GEH1062 and while the mod is about supernatural stuff, it is more sociology related because the Prof is a sociologist by training. So its more about how supernatural stuff is linked to society etc. The workload for the mod shld be manageable - abt 1 reading per week + grp presentation (prof doesn''t focus much on your presentation skills so you can read off your script) + the exams are open-book. I do plan to take this mod as I have had good experiences taking another mod under the same Prof. You do get to watch supernatural movies but the analysis should be more about how it links to society!","It was pretty manageable! They gave us questions about the film to answer during tutorials. They''re quite simple, can be done in 15-20 minutes. The only issue is that the tutorials are kinda short, so everyone is competing for class participation.

Assignments wise there''s an essay, a mid-term and a final. For the essay, they''ll give a bunch of questions on the different films, just answer one. The questions are pretty straightforward and they give ample time to do. For the exams, they''ll let u watch a few scenes and they''ll ask questions based on the scene. It''s mostly on the film techniques. My finals were open book but I dunno if it''s the same this year haha","Hi! Taken the mod before, Dr Gilbert is one of the most profs out there, I thoroughly enjoyed the movies screened bc they aren’t your normal Netflix finds. We were given the option to either make a short film or do an essay so if essays are ya quite your thing you can produce short films instead, they’re arguably more fun!",5.76,0,"23.52,11.51,25.85,10.59,28.52"
242,GEH1056,"Hey! I took NM2209 last sem! I found it alright, the content was pretty interesting and the workload was really really light. 

Due to covid most of the lectures and tutorials were done online. It was quite slack, just sharing answers to tutorial questions given beforehand. The class participation portion is quite competitive however. I found it a bit of a waste of time tbh. 

The workload was just one news report and one essay. The news report was analysing a news article and applying what whatever learnt to explain the article.

For the essay, the Prof gave 5 very broad themes and we could write anything within the theme. For example the theme I chose was relationships and dating, and I wrote about deception on online dating apps. The only complaint I have was that the essay was pretty time-consumung cus the word limit was 3.5k. The news report was 30% of the grade, and the essay was 50%. The other 20% was class participation and attendance. 

So yeah overall it was quite a slack mod haha, the content and readings are v manageable as well! I don''t know if it''s different for this semester cus the Prof changed the workload due to covid. Initially it was mid-terms and finals instead of the essay. 

Any questions feel free to ask!",NULL,NULL,7.65,0,"20,5,20,10,45"
243,GEH1060,"Managed to find these reviews. Hope it helps!

https://www.google.com/amp/s/plainjanesreviews.wordpress.com/2019/01/07/module-review-geh1060/amp/

https://www.google.com/amp/s/breakout2016.wordpress.com/2020/01/11/review-for-geh1060-social-history-of-piano/amp/

https://www.google.com/amp/s/econsnstats.wordpress.com/2017/12/18/module-review-geh1060-social-history-of-the-piano/amp/

https://dinerlobster.wordpress.com/category/ge-mods/ (This ones from last sem!)",NULL,NULL,7.63,0,"0,0,33,0,67"
244,GEH1062,"Hey! I took NM2209 last sem! I found it alright, the content was pretty interesting and the workload was really really light. 

Due to covid most of the lectures and tutorials were done online. It was quite slack, just sharing answers to tutorial questions given beforehand. The class participation portion is quite competitive however. I found it a bit of a waste of time tbh. 

The workload was just one news report and one essay. The news report was analysing a news article and applying what whatever learnt to explain the article.

For the essay, the Prof gave 5 very broad themes and we could write anything within the theme. For example the theme I chose was relationships and dating, and I wrote about deception on online dating apps. The only complaint I have was that the essay was pretty time-consumung cus the word limit was 3.5k. The news report was 30% of the grade, and the essay was 50%. The other 20% was class participation and attendance. 

So yeah overall it was quite a slack mod haha, the content and readings are v manageable as well! I don''t know if it''s different for this semester cus the Prof changed the workload due to covid. Initially it was mid-terms and finals instead of the essay. 

Any questions feel free to ask!","Hello! I took the module last year - there will be live Zoom lessons, and the lectures will be recorded and uploaded onto Luminus for review.",Listen here GES1035 doesn’t need any review since it is CS/CU easy af,5,0,"6.16,6.32,6.16,37.77,43.59"
245,GEH1070,"i’m taking it this sem, it’s quite an interesting mod, esp if you’re curious about tcm. they cover stuff like five elements, yin & yang, qi and pulse reading etc. everything is covered in english & they provide pin yin for the technical chinese terms. so far, the workload has been quite manageable, all the lectures are pre recorded and tutorial is once every two weeks and all we had to do is read readings and discuss! since it’s a general mod, i think they made more more chill and not super technical ! can’t comment much else rn bc we haven’t had mid terms & still in the midst of doing the project but feel free to pm me if you have any qns regarding the mod!",Just aim to pass and S/U that module. Not worth it to put in so much effort for a General Education module that you don't enjoy.,"I asked if I can go to the washroom, TA awarded half a mark for class presence",5.78,0,"9.7,3.46,28.99,13.49,44.37"
247,GEH1076,"Level 1000 modules can be taken by anyone, it just means they''re usually the introductory modules for many majors. For the GE (general elective) modules that you''ve listed, they''re a university requirement for all students, and students slowly clear them usually from year 1 to 3, at their own pace, depending on how they wish to schedule their academic plan. The GE modules are basically all level 1000. Being an exchange student shouldn''t affect things, but I''m not sure how big/small the cohort size is for those specific modules.  

I don''t stay on campus, but from what I hear, halls are the ones with a more vibrant play-around-with-friends life. Generally, students have to participate in hall activities to gain points to have a chance in staying the next semester. Residential colleges usually have a theme or motto that they''re based around, and it will tend to attract people with the same mindset or goals. There''s probably still fun activities going on, but I know a lot of people who just stay there and don''t participate, since they do not need to accumulate participation points to continue staying in the next semester. Either way, I think if you''re open-minded and willing to talk to people and interact with others, you will be able to make friends wherever you go.","I took GEH1049 this semester and worked my ass off to get a B+ haha. 

Can’t speak for the other module but I found this module to be quite time-consuming due to the 2x group projects and final project which required a submission of 4x essays of about 550 words each.","Hi! This is a new module that’s offered in the coming semester, and thus there won’t be any reviews on it. This has been reported by the [Straits Times](https://www.straitstimes.com/sport/football/football-nus-geography-dept-offering-module-that-allows-students-to-explore-issues-in).",4.82,0,"5.01,13.53,26.07,5.76,49.62"
248,GEH1077,"it’s not too late to remake ur poll with fake options / curious options if you want a better result, amateur",Don't even know whether it's even worth putting effort for CA4 at this rate. Just take my SU,thats the thing lol. i cant afford to waste an SU on this. need it for another mod.,4.76,0,"21.25,5.56,11.23,31.81,30.14"
249,GEI1000,"GEI1000 was known as GET1050 during my time. 

You''ll learn the concept of computational thinking, things like loops and conditional statements, Excel skills, pivot tables/charts & VBA programming. I really enjoyed this mod despite my initial fears as my friends who took a sem before me seemed to be struggling alot. Definitely enjoyable for me since Jonathan explains the concepts in a simple manner that the students can understand (also his videos are quite entertaining too). Dunno abt the bell curve. Workload is pretty heavy for a 1k mod, but if you manage your time properly, it is fine in my opinion. There''s a grp project, individual assignments every 2 weeks, weekly(or biweekly) quizzes and short lec videos to watch. You dunnid to prep much for tutorials except to have gone thru the videos before coming to class where you''ll do grp work with ur grpmates!!","Ik u are probably joking but now that you mention it, I just realised none of the GEI-coded modules have CS1010% as a preclusion, and this feels like a loophole they should probably close.

It''s not fair for non-STEM students to compete with Computing students and others who''ve alr taken CS1010% in these modules.","GEA1000 was very irritating as they teach the bare minimum and require a lot for the tests. The concepts like 95% ci and basic stats were taught in poly or jc but they really twist the questions. It’s really stupid as the whole curriculum could be based off of your intuition so what’s the point. I would highly suggest joining the telegram group if have to gather different opinions of other ppl abou the answers

Mid terms
Final test (no exam)
Bi weekly quizzes
In class quiz
Group project 
I couldn’t recall the percentage as I couldn’t give a ratass about it",5.29,0,"32.95,2.58,13.75,25.21,25.5"
250,GEI1001,"Hi there,

GEI1001 is not available in AY21/22 (August 2021 -- July 2022). It will only be offered in AY22/23 (August 2022 -- July 2023). In other words, your cohort of CHS students will take it in Year 2.

See here for the availability of CHS common curriculum modules: [https://fass.nus.edu.sg/current-students/information-for-freshmen/chs-common-curriculum/](https://fass.nus.edu.sg/current-students/information-for-freshmen/chs-common-curriculum/) (Note that GEI1001 is listed as available only in Semesters 3 and 4, i.e. Year 2).

GET1050 is the previous requirement for FASS students, pre-CHS. The link you provided, in which GET1050 is mentioned, is for Cohort 2020, i.e. students who matriculated in August 2020. Although GET1050 and GEI1001 appear identical, they should be treated as different modules and you should not register for GET1050. Otherwise, you might not be able to read GEI1001 which you need, thus opening an administrative can of worms for yourself.

All the best!

Edit: to answer your question of why one module has two codes, it''s basically because it is being recoded for CHS. But some previous cohorts, who have not graduated yet, still need to complete the module with the old code.",">seems like all fass people have to take it

There are other options you can take. Refer to [CHS website](https://chs.nus.edu.sg/programmes/common-curriculum/digital-literacy) for full list of Digital Literacy modules offered.",well i heard gei is the best. the prof is 👍🏻,5.11,0,"25,2.5,15,0,57.5"
251,GEN2000,"I am a TS major, and just going to say that Dr Robin Loon, who is teaching GEN2001, is a really good prof. He is really engaging, helpful and very passionate when teaching and in theatre. Even if you have no interest in theatre, I think it’s really no harm trying something new and who knows, you might love it in the end :) Also, from LumiNUS, the module is also taught by two outside theatre practitioner who has a wide range of expertise in using theatre to engage with the community, so I think you will learn a lot from them too",NULL,NULL,6.17,0,"25,0,0,42,33"
252,GEN2001,"I am a TS major, and just going to say that Dr Robin Loon, who is teaching GEN2001, is a really good prof. He is really engaging, helpful and very passionate when teaching and in theatre. Even if you have no interest in theatre, I think it’s really no harm trying something new and who knows, you might love it in the end :) Also, from LumiNUS, the module is also taught by two outside theatre practitioner who has a wide range of expertise in using theatre to engage with the community, so I think you will learn a lot from them too",NULL,NULL,6.17,0,"25,0,0,42,33"
253,GEN2002,"Hmm I agree with you partially, but this system still seems somewhat restrictive for students who already engage in community service activities who want to get academic credit (MCs) for their activities.

Students still need to fit into the modular structure, take part in module activities, and work under the restrictions of the module. For instance, most of the modules in the OP seem to be limited to a certain agency (e.g. GEN2070 is limited to ComLink).

This is unlike the system in SMU which also gives academic credit for Community Service but seems to be much more flexible.

>Students \[in SMU\] may also consider self-proposing if they are already volunteering in their personal capacity, or have found a social cause or a volunteering opportunity that they are keen to join.

[Source](https://corecurriculum.smu.edu.sg/faqs)

Also, I believe all these modules (at the very least, are planned to) involve a substantial practical component and are not purely/mainly theoretical in nature. The description for most of the modules mention that they will involve actual practical components, using phrases like hands-on experiences, experiential learning, and They will apply these skills. Also, as mentioned in my posts, all these modules appear to have a substantial proportion of their workload allocated to project(s).","GE mods expands my horizons in the humanities and makes me a more well-rounded individual

My code compiles on the first try



-Quoted from  List of things you will never hear a computing student say

/s","HAHA uh to be honest, yes lol

I mean, I obviously don''t check the entire NUS website (I have better things to do with my time lol). I mainly check the website I expect (or hope) to be updated.

The list of Gen Ed modules on the Registrar''s Office webpage is one such example (Hence, this post). Some other pages I am checking regularly for now is the DDP Common Curriculum mappings and the NUS College website.",4.6,0,"15.91,0,23.92,15.35,44.83"
