id,code,comment1,comment2,comment3,rating,searched,emotions
61,CS1010S,"No doubt that the SU policy did have an impact on more people failing/getting 0.  I’m sure nobody would contend against that.

There’s another factor, however.  Wasn’t there a legendary TA (IYKYK) that was super good and practically helped literally everyone, even those who weren’t under him.  This TA went above and beyond every semester, even creating extra help sessions and an entire telegram group to discuss. I heard last sem was the last one for which he continued with prof LWK.  I have also heard that for some reason, some of the other TAs are just very terrible. This star TA has practically carried the everyone else.  Shoutout to him.

Perhaps the key better performance is to look at the TAs first.  I don’t think Dr Ben Leong’s opinion is entirely accurate.","Similar, this came with a extra GE pillar we have to complete and with the change in curriculums and faculty combinations, we have to take some fluff mods and mods not directly related to one’s discipline (e.g the often cited DTK1234, HSI if I’m not wrong)

U seem to have failed to recognize this point as pointed out by u/steamedchickenfeet and only pointed that “oh now can s/u D, ez life”. It’s not like u can s/u every mod (since we only have 8 max and 5 expires by y1) and if u use every s/u, 
the CAP becomes volatile to later grades 

And now as noted by OP’s post, the bar to s/u is so low that if u didn’t fail, u can basically s/u, and if people determine from the start that they don’t want to do well for the mod for various reasons, they now just need to give the bare minimum to pass, when before the s/u change, one would to try for a minimum C which is harder. So although more lenient, the new policy kinda degraded the meaning of S/U and now it’s become an exploit of sorts. In the end, there is both gd and bad to be seen in the new system

That said, hope u have prepared for yr finals and all the best as well","Lmao same, I couldn''t understand shit so I couldn''t code for shit. It also felt annoying to see \[EASY\] then I''m like bro I can''t solve it and that \[EASY\] is just hella taunting.  


I didn''t even want to mention the typos and shit, from PE till now, I felt like he simply did not have a single soul to vet through his paper.",4.74,6,"6.32,11.69,22.05,23.32,36.62"
402,MA1521,"To Prof if you read this ,

Please don’t be dejected if you see this, I can tell the effort you put in aka marking tutorials by hand even with your workload, really helps me learn how to properly write my math solutions out . For every mod there will always be cheaters, see the 1010 fiasco that happened on the news last year . 

But in my view what’s more important is that the students learn more than just formulas in math mods , which is nice with the inclusion of Theorems . While sometimes I have to rewatch lectures because I’m slower , it’s nice to understand why we use these in mathematics. 

My friends and I will still try our best for this mod even if the curve is a little skewed as personally grades aren’t everything  , eventually cheaters get caught whether it’s in NUS or the workspace where the consequences are even worst .

Feel free to pm, as I can share that while annoyed, not all of us are freaking out about those cheating","I’m at that point where I can’t tell whether if I’m just either really stupid and everyone is a math god from the fourth dimension or a good chunk of people are just cheating.

I’ve been watching khan academy videos, throwing most of my time into revision for math, practicing from the textbook, and still constantly get stumped by the questions prof throw at us. 

The recent exams has been a huge hit to my morale. Even if I do barely pass the paper, I know for a fact I’ll be the bottom 10% with how the bellcurve has been so far. 

I think the worse part was the recent emails where the prof stated the first 30 papers he marked he found a lot of answers that were similar, and he must have found a lot more since he mentioned that he’s gonna drop the investigation cause it’s just too time consuming.

Either everyone manage to solve it using the same method (which is possible since math is math, how many solution can u come up with), or everyone somehow manage to get the answer from the same source.

Please note I’m in no way blaming the prof here, he’s really trying his best but there’s only so much he can do alone and against 700+ students. He’s an extremely dedicated and amazing professor. He actually wanted to contact and interview all the students in question but I think there were just too many that he can’t do it.

Seeing the current bellcurve it feels like getting 80 won’t even be enough for a B. I know getting a C to SU won’t be too difficult, but it’s frustrating knowing that no matter how hard you try, there’s nothing that can be done since the grounds were never fair to begin with.

Edit: Prof sent an email to clear up a misunderstanding. He found scripts that were similar but is not trying to imply that there are maybe a lot of cheaters. He did contact some students due to the similarity and will try a new way of proctoring for the last exam that will hopefully deter some cheaters.","Have to disagree with you on this. Even with discussion, an exam is meant to be done primarily by yourself, with discussion meant to help you when you get stuck. It should be possible for a sizeable proportion of the cohort to finish the paper on their own.

Heck I rmb in CS1010S, or any other intro CS mod that the profs would be repeatedly emphasising that any discussion for missions or what not meant we discuss pseudo code or the way to attack the question, and then everyone goes and does the question themselves. From what you described, it seems that the only way to do well/decently is to have different people work on different aspects of the solution and then share their solutions. If people tried to say sharing answers like that constituted discussion, Prof Ben/WaiKay/any other CS1010 prof would give them a straight F and send them to Disciplinary Panel.

Unless the prof explicitly said beforehand that he set the paper so that students were meant to do it together, I feel it flies in the face of everything the SOC profs have been telling us about not plagiarising other’s code. Granted I did not take CS2100 that semester, but heck any student that failed badly has a valid reason (and should) raise it to the Faculty and School that they should not be penalised for doing an exam on their own.

Being allowed to discuss is absolutely different from people working on different parts and sharing their answers, and its pretty duplicitous if the prof said ‘discuss’ and not ‘work on it together’.",4.47,4,"14.75,8.72,19.95,23.55,33.03"
331,IS2101,"The content taught is equally useless, but the workload is much higher, and you can''t SU it. On the bright side, no coding involved, and you can  simply skip all the lectures if you''re not interested in the content. my recitation teacher was really kind and my classmates were good though. but doesn''t mask the fact that the mod is absolutely horrendous.",Basically that’s how I do presentation in real life🙃🙃,"nope, its worse. The group project will take up even more time, and there are presentations and stuff as well. But after IS2101 you will be more used to this tempo. Also, BZA and infosec students take this mod as well, so the bell curve is steeper.",4.63,1,"7.5,6.25,12.5,26.25,47.5"
194,FIN3716,"Not just biz kids, but non-biz kids taking finance related modules (econs for example). Blindly jumping in just coz of high pay.",I have registered for it as well. There seems to be a lot of excel involved. Can anyone who took it before provide some insights,NULL,7.05,0,"16.5,0,29,21,33.5"
195,FIN3719,"Took this module last semester. It is very easy if you are well versed in personal finance but it is a lot of things to memorise if you do not know much about the topic. It is a very good module to learn life skills from and to be honest, content is pretty easy and less but quizzes are closed book so being good at memorising is required to do well. The questions are mostly from the notes so difficulty is Low but the bell curve is also tough as a result. Not advised if grades are a concern and you have no knowledge of the content beforehand but advised if you are okay with B+ and want to learn.",NULL,NULL,4.14,0,"11.88,0,11.88,23.76,52.48"
196,FIN3720,"FIN3715 - prof was really nice, though I don''t think he teaches the best.

Mids and Finals are relatively easy as long as you study for them and take notes in class since the questions either come from tutorial practices and/or stuff he mentioned in class.

The group project was kinda free-and-easy in the sense that we could choose any topic to do as long as it involved the evaluation of some kind of risk and insurance - you could consult the prof to check if your selected scope is acceptable.

Overall, I''d say the mod is generally quite enjoyable to take and it ain''t that hard to score :-)",Agree with this. Mod is really easy because there is so few concepts and most of the lecture is just the prof going through examples. Be warned it is an essay writing mod so if you are good at that then u should be fine.,NULL,4.75,0,"35.32,7.96,7.96,5.47,43.28"
197,FIN3721,I am also looking to take this mod and interested to find out more too!,NULL,NULL,3.91,0,"100,0,0,0,0"
198,FIN3761A,Yeah 3761X counts towards your specialisation elective requirement,NULL,NULL,4.35,0,"0,0,0,0,100"
199,FIN4125,">not sure if 2nd mjor in bm can allow me to specialise in fin

The Finance specialisation is only open to students enrolled in a BBA or BBA (Acc) degree.

However, as to whether you can take FIN4720 or not, you might want to note that to even take FIN4720, you need to clear FIN3701 and FIN3702, which has FIN2704 as a pre req and FIN2704 has ACC1701 as a pre req. So you are looking at 24 MCs worth of UEs just to complete that whole set of modules. You might want to consider if it is worth using that many UEs or do you even have that many UEs in the first place (seeing as you are looking to do a 2nd major etc.)

Also, [iirc non biz students can only take biz modules with a ''X'' at the end of the module code](https://www.reddit.com/r/nus/comments/kpyxv7/can_nonbiz_students_bid_for_nonx_coded_mods/) (eg FIN2704X, DAO1704X). For the rest of the modules, you might be precluded from bidding for them. You might want to drop the faculty an email to check whether non biz students can actually bid for FIN4720, since it does not have a ''X'' in the module code.","Am doing a second major in business management and I’m from CNM. You can take modules w/o the suffix X eg MNO2705 or MKT3701. But when there is a X eg FIN2704X, you can only take those with the suffix X. All these will count towards your unrestricted electives. 

During your study at NUS, you can create your own double degree but you usually need to fulfil some prerequisites first - eg fulfil X number of MCs. It’s best to clarify with the school about this.","Hi, you can find information on prequisites on nusmods and information on second majors on Google. All the best!",4.77,0,"9.67,0,11,33.33,46"
200,FIN4715,"I took FIN4715 AND MNO4711.

FIN4715: Was really fun and interesting actually. Prof Lam was kinda strict, but very informative and knowledgeable about impact investing and introducing new concepts/frameworks. There wasn''t much finance involved until the actual group project, though fin knowledge does help you understand the topics a bit better. Definitely a recommend if you like social entrepreneurship work, or are interested in social enterprises.

MN04711: If you get Prof Andreas, don''t bother. Run and don''t look back. Take any other 4K mod and you''ll have a more educational experience. You won''t have to succumb to the winds of fate or whatever inane method of assessment has been created (50% of your grade won''t be subject to chaos theory). The course outline in theory sounds awesome, learning about consulting, but unless you get another Prof or you already have consulting experience, I''m afraid you''ll learn more from an internship instead.","Have taken FIN4721 and the module really gives you that foundational knowledge of blockchain, AI and QC. The prof is knowledgeable and passionate, and often gives some real world examples to aid in your teaching. In terms of difficulty and workload, it is alright - slides may seem a lot but it’s manageable. Exams are open book MCQ and you’ll need to submit a learning journal each week documenting what you’ve learned and how it has helped u as well as a final term project.
Not rlly great in finance but scored an A-",digressing but where is the quantum element in FIN4721 LOL,6.28,0,"6.5,3.75,30.25,21.25,38.25"
201,FIN4717,digressing but where is the quantum element in FIN4721 LOL,NULL,NULL,4.35,0,"0,0,100,0,0"
202,FIN4718,digressing but where is the quantum element in FIN4721 LOL,NULL,NULL,4.35,0,"0,0,100,0,0"
203,FIN4719,"I took FIN4715 AND MNO4711.

FIN4715: Was really fun and interesting actually. Prof Lam was kinda strict, but very informative and knowledgeable about impact investing and introducing new concepts/frameworks. There wasn''t much finance involved until the actual group project, though fin knowledge does help you understand the topics a bit better. Definitely a recommend if you like social entrepreneurship work, or are interested in social enterprises.

MN04711: If you get Prof Andreas, don''t bother. Run and don''t look back. Take any other 4K mod and you''ll have a more educational experience. You won''t have to succumb to the winds of fate or whatever inane method of assessment has been created (50% of your grade won''t be subject to chaos theory). The course outline in theory sounds awesome, learning about consulting, but unless you get another Prof or you already have consulting experience, I''m afraid you''ll learn more from an internship instead.","I have taken FIN4721 and I would say it’s a pretty interesting module with a great prof! Content is very relevant now and the prof is very helpful in aiding us in our understanding. Content may seem very intimidating but i guarantee u it is not! Project, at least when I took it was to come up with a business idea using what was taught or analyse current models and what could be improved upon (what is working or not working) - lots of flexibility here. Exams were open book MCQ so  don’t waste time memorising and understand the content instead. Weekly Reflection journals about what you learned and how it is applicable for ur future be it career or in life. And no there is no programming in the course!",NULL,6.88,0,"19,2.5,8.5,8,62"
497,MKT2711,"no, it''s not compulsory. it''s meant to be taken as a UE so even non-Marketing spec ppl can take it.. hope that helps","With effect from AY2021/2022 Semester 2, GEQ1000 Asking Questions will no longer be offered",NULL,5.7,0,"0,0,41.5,0,58.5"
498,MKT3701A,Can not bad just class part only xd,NULL,NULL,6.15,0,"50,0,50,0,0"
58,CS1010,"I did 1010S and I helped my friend out with 1010E and between the two, 1010E was definitely easier ! :) but regardless, some python knowledge will go a long way in helping you for whichever of the two variants you choose to take",cs1010 is good if u like vim and segfaults,"workload wise 1010s is more demanding as you have many assignments to do (in order to increase your levels and then get higher scores) per week while 1010e only have graded assignments once every 2 weeks

exam format wise 1010s require you to write codes on paper for most qns while 1010e just basically mcq and simple fill in the blanks

and difficulty wise I agree with the other commenter

so considering everything 1010e is way easier than 1010s and they''re not even close (dk why ppl in chs are supposed to take much more difficult coding mod then those in engineering considering they''re from stem)

source: took both mods before",4.65,1,"21.7,6.74,8.48,13.02,50.07"
548,ST2334,same! the quizzes are so difficult and 70% finals omg i think im gonna die X\_X,If any kind seniors have it please send it to me too ;\_; I'm already dying at the quizzes and if the finals are even harder I think I'm gonna fail...,"Hi, I took this last sem. 4 sections with no backward navigation between each section. Even though he said the sections get progressively harder, I found that the 3rd section was probably the hardest, so would be good to pace yourself.

I think the lectures and tutorials help to a certain extent,  but the standard in the exams are more tricky like the quizzes and sometimes quite conceptual. If you want a better score it helps to actually understand what the different distributions are used for, and how they relate to each other.",5.25,1,"8.2,3.9,30.9,5,52"
499,MKT3702A,Can not bad just class part only xd,NULL,NULL,6.15,0,"50,0,50,0,0"
500,MLE1010,"ME Year 3 here. I did not do **ME2104** . I did the older version EG1112. I got 6  marks for the midterms as we had negative markings. I had a few friends who got 0.  This is no big deal. If you are sticking to the traditional mechanical design path, the content in this module does not really matter. The most important advice that I can give any uni student is always clear doubts and not wait till the end.

Tbh this is the first time I heard of university tuition. Honestly, this should not be the way. You have to be more independent. I learned more than Youtube than from uni lectures. I would advise you against ''tuition''.

When I was suffering from EG1112, I decided to focus on CS1010E and GE.  It worked out well as I did well in those and even went on to do CS minor. For my EG1112 I got a B and I SU it (6MC). I was scared of 2K modules just like you in year 1. However, in terms of the bell curve, 2k mods are more relaxed as many people don''t do as well in those. I did reasonably well in those.

Finally, don''t worry too much about the grades. I am currently a second lower. However, I am working in a govt agency and earning more than my friends who are second upper. Your skills and experience matter more.","[https://ibb.co/3WzXPkP](https://ibb.co/3WzXPkP)

I am not a stellar student, the above photo shows my first 3 sems and where I am at the moment. Don''t be too fixated on the first class honours. After awhile you will realise like me that University is just a tool to learn more skills to get them certified and to network with lifelong friends who may like your attitude and pull you into their companies irregardless of how bad your honours are. This is me: [https://www.linkedin.com/in/kwekhongwei/](https://www.linkedin.com/in/kwekhongwei/)

I secured my IA in the first week of application because I knew video editing and Japanese, apart from being a ordinary engineer with an additional Solidworks CSWA certification (This course was hosted by NUS for free over winter break). I just happened to be what the company was looking for. They chose me not because of my CAP but my skills. And despite my second lower CAP, I made it into Aero Spec just a few days ago because I have relevant experiences from SYFC, NUS UAV Team...

Stop being limited by grades, find your own worth. I am sure employers and NUS don''t just judge you based on grades, their guidelines are not meant to be strongly adhered.

I know a ME senior who graduate with 2.4 CAP, he is in the UK now doing aeronautics. He was invited back to NUS to give a talk during CFG1002. Success isn''t all about grades. This is him: [https://www.linkedin.com/in/noel-png-303b86124/](https://www.linkedin.com/in/noel-png-303b86124/) (He inspired me alot)

Talk to me if you need, holler at me on Tele @ benseun","I was in the exact same position as you are one year ago.
I did 28mc and it was my best performing sem since it was mostly intro mods and GEs. i would suggest dropping geq and doing other ge mods instead since geq is cs/u  Can do 2102 since no prereq and abit of overlap with eg1301. Bewarned that es and mle is prealloc and so u need to appeal for it. My stupid ass didnt and i miss the boat. Get1042 is highly competitive and u should plan for backups.",5.42,0,"12.26,0.75,19.93,29.27,37.78"
501,MLE2104,"Actually it’s pretty hard to comment on the difficulty cuz everyone learns quite differently. Common consensus is ME2121 is quite difficult. 2114 and 2104 were not required for my cohort so I can’t comment. But hey if you can afford to go on exchange, I think it will be a good experience, your modules will also be on a pass fail basis. Also deepen friendship (or more) with your friend.",The assessments for the mod is pretty bad,Hmmm maybe different batches idk hahaha or maybe its just a personal thing,5.13,0,"40.8,3.68,3.68,3.68,48.16"
502,MNO1706B,Are you confirmed that you need to do QET because not everyone needs to do QET.,"GEs are good precisely because you aren''t used to the uni system, and the system of participation, projects, etc in uni. 

u can choose what you''re interested in (or what u hear is easy to score well) for the GEs (1 in each of the 5 pillars), with the exception of GER and GEQ. Whatever u choose to take will not affect your future plans. 

Taking a GE essentially keeps your options open so that you can decide in future sems whether u want a second minor/major/2nd specialisation when you''re more experienced w how it works in uni/biz",You should bid for a GE in Round 2. I cleared a GET module in the semester I was preallocated your basket of modules.,4.41,0,"2.75,2.75,2.75,27.75,64"
503,MNO1706D,"DAO2703 will most likely be pre-allocated to you in Y2, so you don''t really need to do it now (and most other Y1s won''t be doing it either). i would recommend doing a GE mod since you didn''t do any last semester. also, you should clear your QET quickly so you can apply for ES2002 (another compulsory mod)!",You can’t bid for GE mods in Round 1,😭😭 you are right on the part where I'm terribly confused..I shall look it up on the website for more info.. hopefully I don't mess up this round of mod reg,3.91,0,"0,25,0,50,25"
504,MNO2705A,"It is more or less the same. They represent the different classes, that are taught by different profs & you will be graded as a class.

Probably the only difference is that different profs might conduct the class abit differently and have different grading requirements (e.g. Class A has 15% Class participation, whereas in Class B its only 10%, etc.)/",Fellow BBA student here. Can attest to the above. You might want to find out from your seniors or friends about the lecturer/professor in charge of each sectional and decide if you would be a good fit in their class. All the best!,NULL,6.44,0,"30.15,0,47.74,6.03,16.08"
505,MNO2705B,"It is more or less the same. They represent the different classes, that are taught by different profs & you will be graded as a class.

Probably the only difference is that different profs might conduct the class abit differently and have different grading requirements (e.g. Class A has 15% Class participation, whereas in Class B its only 10%, etc.)/",Fellow BBA student here. Can attest to the above. You might want to find out from your seniors or friends about the lecturer/professor in charge of each sectional and decide if you would be a good fit in their class. All the best!,NULL,6.44,0,"30.15,0,47.74,6.03,16.08"
506,MNO2706,"Not sure how the module bidding works for exchange students but ES2002 and MNO2706  are usually pre-allocated to biz students, meaning to say that when the Module Registration (Modreg) opens, there would be close to 0 vacancies because the vacancies would have already been allocated beforehand.

Besides, I think MNO2706 is strictly only for NUS Accountancy students, meaning if you''re not in the NUS Accountancy programme, I think you will not be able to even bid for it.

As for MKT modules, I''m not too sure as I''m not a Marketing student.",it is possible to drop mods now and the “unable to secure mod” appeal period is currently open till 22 jan so u will be able to appeal for bba mods but whether there’s vacancy is another issue,I don’t think u can come cuz of corona...,4.97,0,"11.25,5,0,13.25,70.5"
