id,code,comment1,comment2,comment3,rating,searched,emotions
366,LAK3202,"Took both modules in AY20/21, module coordinator was Ms Cho Jin Hee.

**Disclaimer:** As Ms Cho is no longer the module coordinator for these modules, and according to LumiNUS, the coordinators for LAK3201 and LAK3202 are different for AY21/22, not all of what I talk about below will be applicable to you, so you can just take it as a reference but it won''t be definitive of your experience.

For example, from what I see on LumiNUS, you will have an oral test and weekly reflection note submissions next semester. We didn''t have these last year; our oral component was just a video assignment, similar to in LAK3201.

In my experience, LAK3202 was more manageable in terms of workload than LAK3201. Several factors:

(a) No quiz in Weeks 4 and 10 for LAK3202

(b) For LAK3201, we had a writing/essay exam in the same week as the final LumiNUS quiz exam. This was originally going to be the same for LAK3202 (which you might see on LumiNUS), but Ms Cho removed this for LAK3202 after student feedback.

(c) We also had weekly typing practice for the first half of LAK3201 (where we just type out a short passage and submit, just for practice). Even though this wasn''t graded and technically you could just copy-paste, it was just another component of the workload that added up with the other stuff.

As for the content, I think there isn''t a huge jump from LAK3201 to LAK3202. Obviously it will be more challenging and needs effort to understand and familiarise but I think it''s just natural progression so I didn''t find it too bad. One additional thing in LAK3202 was that for each e-Lecture, we learned a figure of speech/expression. So this one just involves a bit more memory work/practice. But idk if you will have this next sem as well.

About the weekly reflection note, I assume that it will be in a similar format as what we do in LAK4201. If so, here''s my input on that.

For LAK4201 weekly reflection notes, we just have to journal our learning process and thoughts on our learning experience in the past week. The aim is to get us to be more conscious of our learning experience and also gain practice writing in Korean. Dr. Park emphasised that she won''t grade based on Korean accuracy; it''s purely based on submission.

My thoughts: It does add to the weekly workload and at times I felt quite sian to have to think of what to write at the end of the week. But this isn''t a very heavy component, just honestly write what you think and can finish within 1 hour or even 30 mins (depending on typing speed I guess).

But yeah this one is just my experience, not sure if yours will be the same next semester. If anything you can always email the module coordinator to clarify some of the assessment components.

Personally, I would say that you should just go for it, if your other module choices are manageable as well. If you enjoyed LAK3201, I think you will enjoy LAK3202 too.

Also, (if your flair is accurate and you''re in Year 1), just use your S/Us if necessary lor. Language modules can S/U so don''t stress too much haha. Another thing to note is that you might get modrekt cos of seniority level, so you might not get your first choice lecture slot. (But then again it seems you''ll have 5 lecture slots as opposed to 4 that we had last year, so not so bad.)

Hope this helps! 화이팅~~",NULL,NULL,6.76,0,"6,11,14,25,44"
367,LAM1201,"Took it last sem, so it might be different this sem but they gave us a scenario and we had to come up with a dialogue for two.

1. About 20-30 mins iirc
2. No
3. Yes my tutor was the tester
4. Yes about a week after","not sure abt 4 but probably not! should be assessed individually.

There wasn’t a picture, just a scenario in words","Oh I see.. That way, I''m not sure if my prof will release any stats too... hopefully we can see it when luminus gradebook gets updated. 

Don''t worry, this is only 30%. There is still 70% left.. I think even if u did badly in this one, there is still chance to get B+ if u do well for the rest. Depends on class performance also, so we cant really tell anything yet..",5.57,0,"0,25,18.75,12.5,43.75"
368,LAR1201,"Its a tough mod especially after week 6. People who have read the quran will struggle with it too but after wk6. However, I feel that for level 1 language mods NUS gives everyone a decent grade.","Hey, I took the language 2 sems back and there was also a Chinese student in my class. The first half of the semester is still manageable since we are still learning the alphabets and how to join them to form words. It gets more challenging in the second half of the Semester when we learn verbs and how to conjugate them as well as prepositions etc. Vocabulary wise, it is not heavy at all. Overall, if you work weekly on recognising the letters and slowly picking up the vocabulary etc, you will be fine.

There are no group assessments for this module (which I find a good thing, IMO) plus the prof is really nice and encouraging! I got a B+ as my overall grade",Very doable especially if you have prior knowledge of arabic alphabets!,5.37,0,"5.69,2.68,33.44,2.68,55.52"
369,LAS1201,"i took LAS1201 in 21/22 Sem 1. It''s a really fun module. The textbook is compulsory and kinda expensive (~$50) but its used for both Spanish 1 and 2, so its not that expensive if u pursue Spanish 2 too.

Assessment: 2 quizzes (25% each), held in Week 6 and Week 12 (or 11 i forgot). An oral test on Week 13 (20%). We also had to film a video/skit in groups of 3 and it was 20%. The skit is honestly just to have fun and be creative and make your prof laugh as much as possible lol. Final 10% is class participation. Your prof will usually rotate who they call on so it should be fine. Anyways as a language mod, you would probably naturally have lots of questions so class part shouldn''t be that bad.

Profs: Depends on who you get. My prof was really good and engaging and I was always looked forward to lessons. I''ve heard that other profs aren''t as interesting/engaging though.

Overall, if you''re just looking for a UE to do and a new language to pick up at the same time, spanish is not a bad choice. If you start out early, you can even potentially build a minor out of it",NULL,NULL,6.44,0,"17,11,28,11,33"
370,LAS2201,"Hey, so sorry, should''ve made it more clear in the original comment!

Took the placement test, got placed, but decided against taking the mod due to other timetable clashes that arose.

Wanted to give you an idea of where you might be placed, that''s all!

If you''ve kept up w your Spanish even a little bit since JC, you might even be placed in Spanish 5!","Did Ab initio Spanish (was very good in the subject, albeit a bit rusty after 2 years of NS) and got placed in Spanish 4 when I took the test, for reference!

All the best!",NULL,5.82,0,"0,0,14.43,21.39,64.18"
371,LAS3201,"Hey, so sorry, should''ve made it more clear in the original comment!

Took the placement test, got placed, but decided against taking the mod due to other timetable clashes that arose.

Wanted to give you an idea of where you might be placed, that''s all!

If you''ve kept up w your Spanish even a little bit since JC, you might even be placed in Spanish 5!","Did Ab initio Spanish (was very good in the subject, albeit a bit rusty after 2 years of NS) and got placed in Spanish 4 when I took the test, for reference!

All the best!",NULL,5.82,0,"0,0,14.43,21.39,64.18"
372,LAS3202,"Hey, so sorry, should''ve made it more clear in the original comment!

Took the placement test, got placed, but decided against taking the mod due to other timetable clashes that arose.

Wanted to give you an idea of where you might be placed, that''s all!

If you''ve kept up w your Spanish even a little bit since JC, you might even be placed in Spanish 5!","Did Ab initio Spanish (was very good in the subject, albeit a bit rusty after 2 years of NS) and got placed in Spanish 4 when I took the test, for reference!

All the best!",NULL,5.82,0,"0,0,14.43,21.39,64.18"
373,LAT1201,"Hi, I’m a biz Yr4 student. Took Thai 1,2,3 with corresponding grades A,A,A+. Initially got asked by a friend to take this mod tgt so we did but he grad after thai 2 alr.

Like all lang mods, in first mod, there will be people with some knowledge of the language alr. But for Thai, unlike other mods like Japanese (took Jap1-3 too), almost everyone has zero  to little knowledge so not to worry. Some people can speak a little Thai, but after week 6-7, everyone should be on equal standing alr 

There are 6 HW sets to be submitted every fortnight, you have like 5 days to complete once released. Very basic for level 1, just sentence construction and writing thai scripts (if you don’t know just refer to the book lol). I would say the grammar taught is very easy, the only tricky parts are the listening quizzes, it may be hard to catch cos they speak rather quickly and we lack exposure.

Oral tests, writing tests are generally okay, not too difficult and that usually give you mock tests beforehand so make sure you do that to prep. Content wise 1 chapter every week but there again, it’s all in phonetic script so quite easy tbh.

The only challenging part for Thai is when it hits level 3, that’s when you start learning very difficult vocabulary and they don’t really strictly follow the textbook anymore. 

The key is consistency, every component counts: your HW, listening, oral, writing, participation,cultural project. Do it seriously! For writing quizzes, make sure you do well (they have the largest component of the grade esp writing test 2). For oral, try to pick a good partner you have chemistry with haha (you would know since you will practice with many peeps in class). If you pick someone who wanna SU this mod then gg alr.

For Thai 1, to secure your A, try to get at least 85% for all your components. Anyways at least for my time, many people I know wanna just take this mod for exposure and intend to SU so curve isn’t too steep. Only for Thai 2-3, the bell curve applies cos cohort is quite small. For that reason at least 1/3 of class should secure A- and above.","Different textbooks have different phonetic ways to interpreting thai script so if you know how to write thai script it’ll be the best if you are doing Thai in the long term. Unfortunately, you still have to abide by NUS’s way of writing phonetic script (yes you’ll be penalised for mistakes) at lower level modules.


You will continue using phonetic script till thai 2 based on the textbook (although Teachers discourage still using phonetic script at Thai 2). Only the last writing quiz for Thai 2 (including closed book compre and composition) would you be required to write in thai scripts. Thai 3 onwards all Thai scripts alr, so in some sense the faster you ditch phonetic script the better off you’ll be.

Anyways, even at Thai 3 level, at least for me, it’s a pain to read thai scripts so when I craft my show and tell, oral presentation scripts, I usually do it with phonetic so I can read and practice my scripts more quickly!",NULL,6.4,0,"9.5,2.5,6.5,33,48.5"
374,LL4219,"i''ve done both ASEAN law and policy + trial of jesus! feel free to DM for more info, would be happy to answer any questions!","i''ve taken trial of jesus! can dm me for more info, but i''ll probably only reply tomorrow because my trial of jesus paper is due tonight LOL",ty! sorry for late reply will msg now :),5.25,0,"11,0,5.67,33.33,50"
375,LSM1111,"Hi. I''m Y3 life science and didn''t have LSM1111 and other new core mods back then. I can answer your third question tho.

&#x200B;

For me, they are like these:

Molecular Genetics: workload is light but the content might be a bit difficult since it involves many molecular stuffs and also math (especially for the third section). Not much reading except you will get some papers to learn before CA.

Evolutionary Biology: probably with the highest workload due to the weekly reading and quizzes. You need to at least read one chapter from a textbook provided each week. If you are someone who is interested in learning evolutionary concepts, these may sound easy for you otherwise you can spend a longer time digesting the concepts especially since the concepts discussed are interconnected. IMO this is probably the best module out of the core 2Ks. 

Molecular Cell Biology: cover stuffs that might be already learned during JC/HS. Workload and content-wise, IMO, it is the lightest and the easiest among the three. Not much reading except lecture slides.","Hey, i''m taking the HSI, HSS and DTK side. From what I''ve heard from ppl doing HSA and HSH side, they sound a lot more time consuming than HSS, HSI and DTK. However, DTK assignments can be q time consuming, and HSS have some required readings, which if u decide to read may take a while. HSI1000 is q easy imo as there''s only pre-recorded lecture videos, no tutorials, only workshops that u have to attend 3 times in the semester and a 4 hour lab that you have to once during the semester, but there''s 3 block tests that make up around 50% of the grade if i''m not wrong, so it''s up to u if u wanna study hard for those.","Hello, I''m taking HSS HSI DTK. HSI & HSS workload are fine with weekly quizzes and the once a month assignment for HSI workshops + 1 lab Sessions. (I havent attend yet). HSI lectures are pre-recorded while HSS is live but they also got upload recording afterwards. 

The one I want to warn you is DTK. Workload is very hands on and submissions are every 2 weeks which seem quite okay at the start but gets more and more heavy as you progress. Had to make short videos and prototypes which can be time-consuming. It''s not hard but just needs time. Actually kinda low-key glad I''m taking DTK now because of the heavy workload so next sem won''t have to tank this.",5.33,0,"9.04,7.89,28.84,11.76,42.47"
376,LSM1301,"Definitely manageable, and the mod was designed to be as such.

Source: Was a PCME major in JC, took LSM1301 and majored in Life Sciences.",Exactly same situation as you in the past. Took LSM1301 and it was pretty fun n enjoyable w the labs and all. I highly recommend this mod if youre interested in bio!,"If you''re asking if it''s possible to score an A for it with your background, it is. But it doesn''t discount the fact that you''re going to have to put in some effort for it. Not sure how else I can quantify easy/difficult since it''s rather subjective.",5.75,0,"22.33,11,11,16.67,39"
377,LSM1303,"Your perception of the workload will heavily depend on your ability.

CS2100 - Difficult class, my friends said otherwise. Guess I''m not too good at the whole low-level thing. Study-able though.

CS2040S - I took the non-S coded variant many semesters ago before the CS cohort exploded, I liked DS/A so I found it fun and manageable

ES1000 - no idea

GEQ1000 - basically a 0.5MC class

GER1000 - see above

ST2334 - if you like probability and combinatorics, this class should be easy for you. Very study-able by chionging PYP if you''re not good at it.

CS2106 - an infamous class (because it''s a graduation requirement) known for its difficulty. I found it manageable (and fun sometimes, especially the last 2 topics on Memory and Filesystems), but the labs can take quite awhile if you''re struggling and if you don''t have friends taking it with you

CS2101 - your typical English class which has presentations and essays sprinkled throughout, and is annoyingly 2x 2hrs per week like all English classes it seems. If you can smoke through presentations or find them easy, it''s an easy class. Otherwise, prepare to suffer.

CS2103T - the workload is as high as you want it to be. If you''re the type where a project is never done til the deadline passes and you''re aiming for A/A+, expect a very high workload in the number of hours you spend on the project. Otherwise, I''m pretty sure you can just chiong it in a week or so. I did the former and got pretty much full marks for the project, but still got a B+ because of the finals, so don''t neglect your theory.

ES1103 - no idea

CS3243 - never took it. a few friends said it was tough and pretty useless though

LSM1303 - no idea, I took a physics class I enjoyed for my science requirement","Just in case it wasn’t a typo, intro to ai is cs3243 rather than cs3234 (a logic module).

Also, cs2101, even tho is cs-coded, is a communication module that can be s/u-ed. If you’re 
planning to s/u it along with some of your other non-cs mods, it will definitely be a very manageable sem.

Otherwise, you might have to invest quite some time in both cs2101 and lsm1303 to get a relatively decent grade, since both have a rather huge group work component. Along with the potentially cancerous cs2106 labs and the relatively heavy cs2103 & cs3243 projects, you might die during that sem if you’re not too strong in programming. 🙃","It overlaps with some lsm3k mods iirc

Unless you are from DVM, or else not rly advisable to take tho. Some say its like LSM1307, others say its like LSM1105. Personally seen the textbook and felt it might be a bit content heavy and not really LS based, hence that might be the reason.",4.56,0,"42.57,6.62,13.23,13.48,24.09"
378,LSM2105,"no past year papers, do the questions at the end of textbook chapters, they should be quite helpful",NULL,NULL,4.35,0,"33.33,0,0,33.33,33.33"
535,SE3222,If there's no graded component for attendance/in-lecture participation etc. then you can safely skip. It's probably polite to let the lecturer know but many people skip without doing that also. Most lectures will be recorded too.,"And by NG I mean non graduating, I''ll be arriving in Singapore late due to covid shit",NULL,4.76,0,"12.5,0,25,25,37.5"
379,LSM2106,"“Dear Students

1. By default, LSM2106 S/U option is not applicable for the CHS cohorts AY21/22 onwards.

2. To accommodate students from before CHS, i.e students of Cohorts AY16/17 to AY20/21 who have yet to complete the essential LSM1106, allowance has been granted to this group of students to exercise S/U option when reading LSM2106. In other words, LSM2106 S/U Option is available for students of Cohorts AY16/17 to AY20/21.

We hope this clarifies.

with best wishes

Dee (admin for LSM2106)”

^ email i got from the LSM2106 coordinator when i took it last sem, i’m from the 20/21 batch. however i think it’s best to still email in to double confirm!","You can check if a mod is S/U-able on NUSMods!

For e.g., on [the NUSMods page for LSM1111](https://nusmods.com/modules/LSM1111/biological-challenges-and-opportunities-for-humankind), under Additional Information, there''s a point Has S/U option for Undergraduate students only, so it''s S/U-able 🥳🥳

But on [the NUSMods page for LSM2106](https://nusmods.com/modules/LSM2106/fundamental-biochemistry), this point isn''t there, so you can''t S/U 😭😭

Hope this helps! Trying to teach a man to fish rather than give him a fish here lol",None of the LSM2k mods can be SUed,4.5,0,"8.33,3.67,24,26,38"
380,LSM2107,"mainly, it really depends on whether the finals (or any lectures etc.) for those 3 mods clash. if they clash there''s no chance you can do all 3 simultaneously.

you should also consider which basket of chs mods you are doing for that sem: the hsa/hsh basket is relatively more rigorous compared to the hsi/hss basket.

lastly, for workload, 2105 and 2106 are quite content heavy. i haven''t taken 2107 yet but i''ve heard that there are a lot of readings which takes a lot of time. i haven''t heard of anyone who is taking all 3 simultaneously.

also, lvl2k lsm mods are not SU-able, just fyi.","Check out nusmods.com that''s where all the modules are listed and there may be reviews listing out the workload for the whole sem

 
If you can''t find any try googling <module code> reviews","lsm2107- taking it this sem w profs john ascher and ian chan. relatively easy module imo, only actual workload are the 40 page readings before every lecture, pre lecture quizzes and 3/4 homework quizzes. not sure if prof ian will be lecturing next sem but he is very clear in his teaching and makes everything easy to understand. prof ascher is fine too, but his slides arent as detailed as prof ian’s imo. 

there is a midterm and final exam, did my midterm and found it quite okay in terms of difficulty. median was about 75% but after adjustment of grades i think.

finals upcoming on 30th lmao

for more detailed reviews you can search “lsm1105 nusmods” on google",5.62,0,"16.51,0,18.8,24.27,40.42"
381,LSM2191,"For me it was a fun experience. You are basically grouped into small groups of 4 and a TA mentors several small groups. You’ll do basic experiments like cloning and protein purification over the course of a semester and you’ll need to write up 2 reports, one due mid sem and one at the end of sem. There is a mid term ÇA and final too, and like most other mods, the content and format of the assessment will depend on the module coordinator. However, the experiments during the practical have been constant over the past 2 years (i took it 5 sems ago and a friend who took it recently verified that they’re still doing the same practicals) so you can ask your seniors for practicals to pre read beforehand. I enjoyed the lab practicals and learning abt the experiments. this mod gave me an indication that research might be something that I would enjoy and hence I went on to take more research projects after this mod. 

Other comments I’ve generally heard were that the practical sessions were long and the reports are taxing (which reports aren’t tho). Some of my friends also realised through this mod that experimental techniques and working at the lab bench wasn’t for them and they steered away from research heavy stuff later on too. Generally I feel LSM2191 being a compulsory mod for all life sci ppl is important because research is fundamental to all scientific discovery and life sci is no exception. But on the other hand, I feel that LSM2191 is also an experience for everyone to get a feel if they can see themselves working in research","It''s really fun, and I truly enjoyed the whole experience. My TA was awesome, and very good at explaining stuff in our lab practicals, which I think helped me a lot in writing the lab reports and for CAs. Practicals were quite fun, though it can be long because of incubation time.

There are 2 lecturers covering this module each semester, and a total of 2 CAs covering the content taught by each lecturer.

I think it''s a very good introduction to how research is like 🙂","Hi! A Y2 LS student here too. Afaik there is no rule that requires LS students to complete LSM2191 in Y2, although highly recommended. I asked some seniors about this and they said the same thing. I also have a friend who’s dropping LSM2191 this coming semester to take her minor module, so yes, you don’t need to take it in Y2. Just got to drop the module before you bud for your other mod.",5.59,0,"24.67,5.33,18,8.33,43.67"
382,LSM2212,"I have a friend who is interested in taking LSM2212 as a UE too...wondering if you are him. In any case, I took it though I am not taking life science as my major (with that being said, I have background in biology) LSM2212 is not a tough mod to understand but it is content-heavy and you would have to do quite a bit of memorisation. There are lectures and anatomy museum/hall to go for. I have some lecture slides...if you are interested, pm me your email and I will send them to you!","To clarify, I took both LSM2251 and LSM2252 under Mr. Sivasothi in different academic years. (Mentioning this because he teaches theses mods in Semester 1 and another lecturer leads them in Semester 2.)

I would say that LSM2252 is considerably lighter than LSM2251 in terms of CAs. There were two essay assignments and one practical exam (where you look at specimens and identify them or characteristics about them), and three field trips. The bulk of the work for LSM2252 lies in content: there''s a huge survey of the animal phyla and a less-huge-but-still-kinda-huge survey of plants. You have to be very familiar with the content and it comes at you like a bullet train. I personally find it easier to deal with content than to rush a whole bunch of projects like in LSM2251 (group work... oh god...), so to me, LSM2252 is lighter than LSM2251.","Ahh i see, yeah I''m actl considering taking ev bio spec but not sure tbh cuz all 3 spec seem interesting to me🤔 Lsm2212 was extremely attractive to overload this sem for me even tho i heard its very heavy mainly becuz the finals is one week after my last finals this sem and I only have 2finals. (I personally prefer having mods with finals). But the prob is if I take Lsm2212, I won''t be able to take lsm2251 anymore (I mean technically is can, but cuz of my major combination, I dh anymore UE left so if i study outside of what is the minimal requirement (three level 2k LS mods, I will have to overload) so I''m thinking of jsut clearing the minimal requirements first then take the UEs im intersted in Y4 if my timetable allows",4.9,0,"15.89,0,14.21,12.88,57.02"
